{
    "description": "OpenEmbedded - 'nodistro' basic configuration, release 5.3 'whinlatter'",
    "expires": "2026-05-31",
    "sources": {
        "bitbake": {
            "git-remote": {
                "remotes": {
                    "origin": {
                        "uri": "https://git.openembedded.org/bitbake"
                    }
                },
                "branch": "2.16",
                "rev": "2.16"
            }
        },
        "openembedded-core": {
            "git-remote": {
                "remotes": {
                    "origin": {
                        "uri": "https://git.openembedded.org/openembedded-core"
                    }
                },
                "branch": "whinlatter",
                "rev": "whinlatter"
            }
        },
        "yocto-docs": {
            "git-remote": {
                "remotes": {
                    "origin": {
                        "uri": "https://git.yoctoproject.org/yocto-docs"
                    }
                },
                "branch": "whinlatter",
                "rev": "whinlatter"
            }
        }
    },
    "bitbake-setup": {
        "configurations": [
        {
            "name": "nodistro",
            "description": "OpenEmbedded 'nodistro'",
            "setup-dir-name": "oe-nodistro-whinlatter",
            "bb-layers": ["openembedded-core/meta"],
            "oe-fragments-one-of": {
                "machine": {
                    "description": "Target machines",
                    "options" : ["machine/qemux86-64", "machine/qemuarm64", "machine/qemuriscv64"]
                }
            }
        }
        ]
    },
    "version": "1.0"
}
