{
    "description": "OpenEmbedded - 'nodistro' basic configuration",
    "sources": {
        "bitbake": {
            "git-remote": {
                "uri": "https://git.openembedded.org/bitbake",
                "branch": "master",
                "rev": "master"
            }
        },
        "openembedded-core": {
            "git-remote": {
                "uri": "https://git.openembedded.org/openembedded-core",
                "branch": "master",
                "rev": "master"
            }
        },
        "yocto-docs": {
            "git-remote": {
                "uri": "https://git.yoctoproject.org/yocto-docs",
                "branch": "master",
                "rev": "master"
            }
        }
    },
    "bitbake-setup": {
        "configurations": [
        {
            "name": "nodistro",
            "description": "OpenEmbedded 'nodistro'",
            "setup-dir-name": "oe-nodistro-master",
            "bb-layers": ["openembedded-core/meta"],
            "oe-fragments-one-of": {
                "machine": {
                    "description": "Target machines",
                    "options" : ["machine/qemux86-64", "machine/qemuarm64", "machine/qemuriscv64"]
                }
            }
        }
        ]
    },
    "version": "1.0"
}
