{
    "description": "OpenEmbedded - 'nodistro' basic configuration, release 6.0 'blacksail'",
    "expires": "2027-05-31",
    "sources": {
        "bitbake": {
            "git-remote": {
                "uri": "https://git.openembedded.org/bitbake",
                "branch": "2.20",
                "rev": "2.20"
            }
        },
        "openembedded-core": {
            "git-remote": {
                "uri": "https://git.openembedded.org/openembedded-core",
                "branch": "blacksail",
                "rev": "blacksail"
            }
        },
        "yocto-docs": {
            "git-remote": {
                "uri": "https://git.yoctoproject.org/yocto-docs",
                "branch": "blacksail",
                "rev": "blacksail"
            }
        }
    },
    "bitbake-setup": {
        "configurations": [
        {
            "name": "nodistro",
            "description": "OpenEmbedded 'nodistro'",
            "setup-dir-name": "oe-nodistro-blacksail",
            "bb-layers": ["openembedded-core/meta"],
            "oe-fragments-one-of": {
                "machine": {
                    "description": "Target machines",
                    "options" : [
                        { "name": "machine/qemux86-64", "description": "x86-64 system on QEMU" },
                        { "name": "machine/qemuarm64", "description": "ARMv8 system on QEMU" },
                        { "name": "machine/qemuriscv64", "description": "RISC-V system on QEMU" }
                    ]
                }
            }
        }
        ]
    },
    "version": "1.0"
}
